create table deposit(actno varchar(25), cname varchar(20), bname varchar(20), amount int, adate date);

create table branch(BNAME varchar(20),CITY varchar(20));

create table customer(CNAME varchar(20), CITY varchar(20));

create table borrow(LOANNNO varchar(20), CNAME varchar(20), BNAME varchar(20), AMOUNT int);
************************************************************************************************************
2)Describe the tables which are already created;
mysql> desc deposit;
+--------+-------------+------+-----+---------+-------+
| Field  | Type        | Null | Key | Default | Extra |
+--------+-------------+------+-----+---------+-------+
| actno  | varchar(25) | YES  |     | NULL    |       |
| cname  | varchar(20) | YES  |     | NULL    |       |
| bname  | varchar(20) | YES  |     | NULL    |       |
| amount | int         | YES  |     | NULL    |       |
| adate  | date        | YES  |     | NULL    |       |
+--------+-------------+------+-----+---------+-------+
5 rows in set (0.00 sec)

mysql> desc branch
    -> ;
+-------+-------------+------+-----+---------+-------+
| Field | Type        | Null | Key | Default | Extra |
+-------+-------------+------+-----+---------+-------+
| BNAME | varchar(20) | YES  |     | NULL    |       |
| CITY  | varchar(20) | YES  |     | NULL    |       |
+-------+-------------+------+-----+---------+-------+
2 rows in set (0.00 sec)

mysql> desc borrow;
+---------+-------------+------+-----+---------+-------+
| Field   | Type        | Null | Key | Default | Extra |
+---------+-------------+------+-----+---------+-------+
| LOANNNO | varchar(20) | YES  |     | NULL    |       |
| CNAME   | varchar(20) | YES  |     | NULL    |       |
| BNAME   | varchar(20) | YES  |     | NULL    |       |
| AMOUNT  | int         | YES  |     | NULL    |       |
+---------+-------------+------+-----+---------+-------+
4 rows in set (0.00 sec)

mysql> desc bustomer;
ERROR 1146 (42S02): Table 'bank.bustomer' doesn't exist
mysql> desc customer;
+-------+-------------+------+-----+---------+-------+
| Field | Type        | Null | Key | Default | Extra |
+-------+-------------+------+-----+---------+-------+
| CNAME | varchar(20) | YES  |     | NULL    |       |
| CITY  | varchar(20) | YES  |     | NULL    |       |
+-------+-------------+------+-----+---------+-------+
2 rows in set (0.00 sec)
*********************************************************************
3) Insert the Values in the tables:

 insert into deposit values
("100", "Anil", "VRCE", 10000.00, "1995-03-01"),
("101", "Sunil", "MGROAD", 50000.00, "1996-01-04"),
("102", "Rahul", "KAROLBAGH", 3500.00, "1995-11-17"),
("103", "Madhuri", "CHADNI", 1200.00, "1995-12-01"),
("104", "Parmod", "MGROAD", 3000.00, "1996-03-27"),
("105", "Sandip", "KAROLBAGH", 2000.00, "1996-03-31");
*********************************************************************
mysql> insert into branch values
("VRCE","NAGPUR"),
("KAROLBAGH", "DELHI"),
("CHANDNI", "DELHI"),
("MGROAD", "BANGLORE");
Query OK, 4 rows affected (0.01 sec)
*********************************************************************
 insert into customer values
("Anil", "CALCUTA"),
("Rahul", "BARODA"),
("Madhuri", "NAGPUR"),
("Parmod", "NAGPUR"),
("Sunil", "DELHI");
*********************************************************************
insert into borrow values
("201", "Anil", "VRCE", 1000.00),
("206", "Rahul", "KAROLBAGH", 5000.00),
("311", "Sunil", "MGROAD", 3000.00),
("321", "Madhuri", "CHANDNI", 2000.00),
("375", "Pramod", "MGROAD", 8000.00);
*********************************************************************
4.Retrieve all the records from the table BORROW where amount in between
2000 and 3000
mysql> select * from borrow WHERE amount BETWEEN 2000 AND 3000;
+---------+---------+---------+--------+
| LOANNNO | CNAME   | BNAME   | AMOUNT |
+---------+---------+---------+--------+
| 311     | Sunil   | MGROAD  |   3000 |
| 321     | Madhuri | CHANDNI |   2000 |
+---------+---------+---------+--------+
2 rows in set (0.00 sec)
*********************************************************************
5. Retrieve the details from the table DEPOSIT
mysql> select * from deposit;
+-------+---------+-----------+--------+------------+
| actno | cname   | bname     | amount | adate      |
+-------+---------+-----------+--------+------------+
| 100   | Anil    | VRCE      |  10000 | 1995-03-01 |
| 101   | Sunil   | MGROAD    |  50000 | 1996-01-04 |
| 102   | Rahul   | KAROLBAGH |   3500 | 1995-11-17 |
| 103   | Madhuri | CHADNI    |   1200 | 1995-12-01 |
| 104   | Parmod  | MGROAD    |   3000 | 1996-03-27 |
| 105   | Sandip  | KAROLBAGH |   2000 | 1996-03-31 |
+-------+---------+-----------+--------+------------+
6 rows in set (0.00 sec)
*********************************************************************
6. Retrieve the customer name, account no of DEPOSIT
select cname, actno from deposit;
+---------+-------+
| cname   | actno |
+---------+-------+
| Anil    | 100   |
| Sunil   | 101   |
| Rahul   | 102   |
| Madhuri | 103   |
| Parmod  | 104   |
| Sandip  | 105   |
+---------+-------+
6 rows in set (0.00 sec)
**********************************************************************
7. Retrieve the name of the customer living in NAGPUR
mysql> select cname from customer where city="nagpur";
+---------+
| cname   |
+---------+
| Madhuri |
| Parmod  |
+---------+
2 rows in set (0.00 sec)
***********************************************************************
8. Retrieve the name of the customers who opened account after 17-NOV-95.
mysql> select cname from deposit where adate > "1995-11-17";
+---------+
| cname   |
+---------+
| Sunil   |
| Madhuri |
| Parmod  |
| Sandip  |
+---------+
4 rows in set (0.00 sec)
***********************************************************************
9. Retrieve the account number and amount of the customer having account opened between
01-12-95 and 01-06.96
mysql> select cname, amount from deposit where adate between "1995-12-01" and "1996-06-01";
+---------+--------+
| cname   | amount |
+---------+--------+
| Sunil   |  50000 |
| Madhuri |   1200 |
| Parmod  |   3000 |
| Sandip  |   2000 |
+---------+--------+
4 rows in set (0.00 sec)
*************************************************************************
10. Retrieve all the records from the table DEPOSIT where CNAME begins
with S.
select * from deposit where  cname like  "s%";
+-------+--------+-----------+--------+------------+
| actno | cname  | bname     | amount | adate      |
+-------+--------+-----------+--------+------------+
| 101   | Sunil  | MGROAD    |  50000 | 1996-01-04 |
| 105   | Sandip | KAROLBAGH |   2000 | 1996-03-31 |
+-------+--------+-----------+--------+------------+
2 rows in set (0.00 sec)
*************************************************************************
11. Retrieve all the records from the table BORROW where 2nd character of
CNAME is U.
mysql> select * from borrow where cname like "_u%";
+---------+-------+--------+--------+
| LOANNNO | CNAME | BNAME  | AMOUNT |
+---------+-------+--------+--------+
| 311     | Sunil | MGROAD |   3000 |
+---------+-------+--------+--------+
1 row in set (0.00 sec)
*************************************************************************
12. Retrieve all the records from the table DEPOSIT where branch name is
CHANDNI or MGROAD ?
mysql> select * from deposit where bname="chandni" OR bname="MGROAD";
+-------+--------+--------+--------+------------+
| actno | cname  | bname  | amount | adate      |
+-------+--------+--------+--------+------------+
| 101   | Sunil  | MGROAD |  50000 | 1996-01-04 |
| 104   | Parmod | MGROAD |   3000 | 1996-03-27 |
+-------+--------+--------+--------+------------+
2 rows in set (0.00 sec)
************************************************************************
13. Retrieve all the records from the table DEPOSIT where branch name is not
CHANDNI or MGROAD.?
mysql> select * from deposit where not bname="chandni" and not bname="MGROAD";
+-------+---------+-----------+--------+------------+
| actno | cname   | bname     | amount | adate      |
+-------+---------+-----------+--------+------------+
| 100   | Anil    | VRCE      |  10000 | 1995-03-01 |
| 102   | Rahul   | KAROLBAGH |   3500 | 1995-11-17 |
| 103   | Madhuri | CHADNI    |   1200 | 1995-12-01 |
| 105   | Sandip  | KAROLBAGH |   2000 | 1996-03-31 |
+-------+---------+-----------+--------+------------+
4 rows in set (0.00 sec)
*************************************************************************
14. Retrieve all the records from DEPOSIT where amount > 1000 and arrange the customer name in ascending order.?
mysql> select * from deposit where amount > 1000 order by cname;
+-------+---------+-----------+--------+------------+
| actno | cname   | bname     | amount | adate      |
+-------+---------+-----------+--------+------------+
| 100   | Anil    | VRCE      |  10000 | 1995-03-01 |
| 103   | Madhuri | CHADNI    |   1200 | 1995-12-01 |
| 104   | Parmod  | MGROAD    |   3000 | 1996-03-27 |
| 102   | Rahul   | KAROLBAGH |   3500 | 1995-11-17 |
| 105   | Sandip  | KAROLBAGH |   2000 | 1996-03-31 |
| 101   | Sunil   | MGROAD    |  50000 | 1996-01-04 |
+-------+---------+-----------+--------+------------+
6 rows in set (0.00 sec)
************************************************************************
15. Retrieve all the records from DEPOSIT where amount > 1000 and arrange the customer name in descending order.?

mysql> select * from deposit where amount > 1000 order by cname desc;
+-------+---------+-----------+--------+------------+
| actno | cname   | bname     | amount | adate      |
+-------+---------+-----------+--------+------------+
| 101   | Sunil   | MGROAD    |  50000 | 1996-01-04 |
| 105   | Sandip  | KAROLBAGH |   2000 | 1996-03-31 |
| 102   | Rahul   | KAROLBAGH |   3500 | 1995-11-17 |
| 104   | Parmod  | MGROAD    |   3000 | 1996-03-27 |
| 103   | Madhuri | CHADNI    |   1200 | 1995-12-01 |
| 100   | Anil    | VRCE      |  10000 | 1995-03-01 |
+-------+---------+-----------+--------+------------+
6 rows in set (0.00 sec)
************************************************************************
16. Retrieve customer details from BORROW table where the third character of
the customer name is either ‘A’ or ‘D’.
mysql> select * from borrow where cname like "__A%" OR cname  like "__D%";
+---------+---------+---------+--------+
| LOANNNO | CNAME   | BNAME   | AMOUNT |
+---------+---------+---------+--------+
| 321     | Madhuri | CHANDNI |   2000 |
| 375     | Pramod  | MGROAD  |   8000 |
+---------+---------+---------+--------+
2 rows in set (0.00 sec)
************************************************************************
17. Retrieve all the records from the table BORROW where amount is not
between 2000 and 8000.?
mysql> select * from deposit where not  amount between 2000 and 8000;
+-------+---------+--------+--------+------------+
| actno | cname   | bname  | amount | adate      |
+-------+---------+--------+--------+------------+
| 100   | Anil    | VRCE   |  10000 | 1995-03-01 |
| 101   | Sunil   | MGROAD |  50000 | 1996-01-04 |
| 103   | Madhuri | CHADNI |   1200 | 1995-12-01 |
+-------+---------+--------+--------+------------+
3 rows in set (0.00 sec)
************************************************************************
18. Find out the unique records from the table DEPOSIT
mysql> select  DISTINCT * from deposit;
+-------+---------+-----------+--------+------------+
| actno | cname   | bname     | amount | adate      |
+-------+---------+-----------+--------+------------+
| 100   | Anil    | VRCE      |  10000 | 1995-03-01 |
| 101   | Sunil   | MGROAD    |  50000 | 1996-01-04 |
| 102   | Rahul   | KAROLBAGH |   3500 | 1995-11-17 |
| 103   | Madhuri | CHADNI    |   1200 | 1995-12-01 |
| 104   | Parmod  | MGROAD    |   3000 | 1996-03-27 |
| 105   | Sandip  | KAROLBAGH |   2000 | 1996-03-31 |
+-------+---------+-----------+--------+------------+
6 rows in set (0.01 sec)
************************************************************************
19. Update the amount of all depositors in deposit table by giving them 10% interest (i.e.
amount=amount * 0.1) where branch is VRCE ?
 update deposit set amount=amount+amount*0.1 where bname="VRCE";
Query OK, 1 row affected (0.02 sec)
Rows matched: 1  Changed: 1  Warnings: 0
************************************************************************
20. Update the amount of all depositors in deposit table by giving them 10% interest where
branch is VRCE and customer name ANIL.?
mysql> update deposit set amount=amount+amount*0.1 where bname="VRCE" AND cname="Anil";
Query OK, 1 row affected (0.01 sec)
Rows matched: 1  Changed: 1  Warnings: 0
************************************************************************
##################----BASIC SQL II----################################
Create table STUIDENT and insert the following data :-
mysql> create table student(
    -> name varchar(20),
    -> rollno int,
    -> branch varchar(20),
    -> city varchar(20));
Query OK, 0 rows affected (0.09 sec)
mysql> insert into student values
    -> ("vijaya",150,"CSE","chennai"),
    -> ("Sita",202,"ETC","kolkata"),
    -> ("Ravi",300,"EEE","Delhi"),
    -> ("Basu",165,"ETC","Chennai"),
    -> ("Rasmi",107,"ETC","Rkl"),
    -> ("Karan",111, "CSE", "CTC"),
    -> ("Rekha", 117,"BME", "BBSR");
Query OK, 7 rows affected (0.01 sec)
Records: 7  Duplicates: 0  Warnings: 0

mysql> select * from student;
+--------+--------+--------+---------+
| name   | rollno | branch | city    |
+--------+--------+--------+---------+
| vijaya |    150 | CSE    | chennai |
| Sita   |    202 | ETC    | kolkata |
| Ravi   |    300 | EEE    | Delhi   |
| Basu   |    165 | ETC    | Chennai |
| Rasmi  |    107 | ETC    | Rkl     |
| Karan  |    111 | CSE    | CTC     |
| Rekha  |    117 | BME    | BBSR    |
+--------+--------+--------+---------+
7 rows in set (0.00 sec)

************************************************************************
1. Count the number of students of each department
mysql> select count(name) from student where branch="CSE";
+-------------+
| count(name) |
+-------------+
|           2 |
+-------------+
1 row in set (0.01 sec)
************************************************************************
2. Count the number of students of each department where the department name starts with ‘E’.
mysql> select count(name) from student where branch like "E%";
+-------------+
| count(name) |
+-------------+
|           4 |
+-------------+
1 row in set (0.00 sec)
************************************************************************
3. Add a field called MARKS to the table STUDENT which can hold a number upto 8 digit length
mysql> alter table student add marks int(8);
Query OK, 0 rows affected, 1 warning (0.06 sec)
Records: 0  Duplicates: 0  Warnings: 1

mysql> select * from student;
+--------+--------+--------+---------+-------+
| name   | rollno | branch | city    | marks |
+--------+--------+--------+---------+-------+
| vijaya |    150 | CSE    | chennai |  NULL |
| Sita   |    202 | ETC    | kolkata |  NULL |
| Ravi   |    300 | EEE    | Delhi   |  NULL |
| Basu   |    165 | ETC    | Chennai |  NULL |
| Rasmi  |    107 | ETC    | Rkl     |  NULL |
| Karan  |    111 | CSE    | CTC     |  NULL |
| Rekha  |    117 | BME    | BBSR    |  NULL |
+--------+--------+--------+---------+-------+
7 rows in set (0.00 sec)
************************************************************************
4. Modify the field :”NAME” of the table STUDENT to hold a maximum of 25 character.
mysql>  alter table student modify name varchar(25);
Query OK, 0 rows affected (0.03 sec)
Records: 0  Duplicates: 0  Warnings: 0
************************************************************************
5. Delete all rows from the table STUDENT where branch is ETC.
mysql> delete from student where branch="ETC";
Query OK, 3 rows affected (0.01 sec)
************************************************************************
6. Rename the table STUDENT to STUDINFORMATION.
alter table student rename to studentinformation;
Query OK, 0 rows affected (0.04 sec)
************************************************************************
7. Delete all the data part from the table STUDENT
 truncate table studentinformation;
Query OK, 0 rows affected (0.04 sec)
************************************************************************
8. Destroy the table STUDENT.?
mysql> drop table studentinformation;
Query OK, 0 rows affected (0.04 sec)

